<!ELEMENT receta (título, dificultad, ingrediente+, paso+)>
<!ELEMENT título (#PCDATA)>
<!ELEMENT dificultad (#PCDATA)>
<!ELEMENT ingrediente (#PCDATA)>
<!ELEMENT paso (#PCDATA)>
